{
  "schema_version": "1",
  "registry_class": "seed_transitional",
  "description": "Program #2273 Task-003 manual seed pilot registry. Transitional only — not operational source of truth.",
  "updated_at": "2026-07-05T12:00:00.000Z",
  "candidates": [
    {
      "candidate_id": "lgfc-gehrig-2026-001",
      "input_stream": "public_research",
      "title": "Gehrig photo lead 1 — National",
      "source_url": "https://baseballhall.org/discover-more/stories/lou-gehrig",
      "source_name": "National Baseball Hall of Fame",
      "source_owner": "National Baseball Hall of Fame",
      "source_domain": "baseballhall.org",
      "source_type": "museum",
      "content_type": "photo",
      "summary": "Manual research candidate 1 from National Baseball Hall of Fame; conservative rights and review defaults.",
      "date_or_period": "1923",
      "people_tags": [
        "Lou Gehrig"
      ],
      "topic_tags": [
        "Lou Gehrig"
      ],
      "location_tags": [
        "Cooperstown"
      ],
      "provenance_notes": "Manual URL intake only; no crawler.",
      "rights_status": "unknown",
      "source_trust_status": "questionable",
      "relevance_status": "relevant",
      "review_status": "pending_review",
      "publication_status": "not_ready",
      "privacy_flag": "none",
      "privacy_review_status": "not_applicable",
      "review_priority": "high",
      "admin_notes": "Seed pilot record; not published.",
      "source_metadata": {
        "date_accessed": "2026-07-05",
        "source_citation": "National Baseball Hall of Fame catalog/search reference"
      },
      "created_at": "2026-07-05T12:00:00.000Z",
      "updated_at": "2026-07-05T12:00:00.000Z"
    },
    {
      "candidate_id": "lgfc-gehrig-2026-002",
      "input_stream": "public_research",
      "title": "Gehrig article lead 2 — Library",
      "source_url": "https://www.loc.gov/search/?q=lou+gehrig",
      "source_name": "Library of Congress",
      "source_owner": "Library of Congress",
      "source_domain": "loc.gov",
      "source_type": "library",
      "content_type": "article",
      "summary": "Manual research candidate 2 from Library of Congress; conservative rights and review defaults.",
      "date_or_period": "1924",
      "people_tags": [
        "Lou Gehrig"
      ],
      "topic_tags": [
        "Yankees",
        "ALS"
      ],
      "location_tags": [
        "New York"
      ],
      "provenance_notes": "Manual URL intake only; no crawler.",
      "rights_status": "public_domain_candidate",
      "source_trust_status": "trusted",
      "relevance_status": "relevant",
      "review_status": "approved_internal_reference",
      "publication_status": "draft_candidate",
      "privacy_flag": "none",
      "privacy_review_status": "not_applicable",
      "credit_line": "Library of Congress — research citation pending final review.",
      "review_priority": "normal",
      "admin_notes": "Seed pilot record; not published.",
      "source_metadata": {
        "date_accessed": "2026-07-05",
        "source_citation": "Library of Congress catalog/search reference"
      },
      "created_at": "2026-07-05T12:00:00.000Z",
      "updated_at": "2026-07-05T12:00:00.000Z"
    },
    {
      "candidate_id": "lgfc-gehrig-2026-003",
      "input_stream": "public_research",
      "title": "Gehrig quote lead 3 — New",
      "source_url": "https://www.nytimes.com/search?query=lou%20gehrig",
      "source_name": "New York Times Archive",
      "source_owner": "New York Times Archive",
      "source_domain": "nytimes.com",
      "source_type": "newspaper",
      "content_type": "quote",
      "summary": "Manual research candidate 3 from New York Times Archive; conservative rights and review defaults.",
      "date_or_period": "1925",
      "people_tags": [
        "Lou Gehrig"
      ],
      "topic_tags": [
        "Farewell Speech"
      ],
      "location_tags": [
        "Cooperstown"
      ],
      "provenance_notes": "Manual URL intake only; no crawler.",
      "rights_status": "permission_needed",
      "source_trust_status": "trusted",
      "relevance_status": "relevant",
      "review_status": "deferred_rights_review",
      "publication_status": "approved_for_publish",
      "privacy_flag": "none",
      "privacy_review_status": "not_applicable",
      "credit_line": "New York Times Archive — research citation pending final review.",
      "review_priority": "normal",
      "admin_notes": "Seed pilot record; not published.",
      "source_metadata": {
        "date_accessed": "2026-07-05",
        "source_citation": "New York Times Archive catalog/search reference"
      },
      "created_at": "2026-07-05T12:00:00.000Z",
      "updated_at": "2026-07-05T12:00:00.000Z"
    },
    {
      "candidate_id": "lgfc-gehrig-2026-004",
      "input_stream": "public_research",
      "title": "Gehrig timeline fact lead 4 — Columbia",
      "source_url": "https://library.columbia.edu/locations/rbml.html",
      "source_name": "Columbia University Archives",
      "source_owner": "Columbia University Archives",
      "source_domain": "library.columbia.edu",
      "source_type": "archive",
      "content_type": "timeline_fact",
      "summary": "Manual research candidate 4 from Columbia University Archives; conservative rights and review defaults.",
      "date_or_period": "1926",
      "people_tags": [
        "Lou Gehrig"
      ],
      "topic_tags": [
        "Columbia"
      ],
      "location_tags": [
        "New York"
      ],
      "provenance_notes": "Manual URL intake only; no crawler.",
      "rights_status": "permission_granted",
      "source_trust_status": "trusted",
      "relevance_status": "relevant",
      "review_status": "rejected",
      "publication_status": "not_ready",
      "privacy_flag": "none",
      "privacy_review_status": "not_applicable",
      "credit_line": "Columbia University Archives — research citation pending final review.",
      "review_priority": "normal",
      "admin_notes": "Seed pilot record; not published.",
      "source_metadata": {
        "date_accessed": "2026-07-05",
        "source_citation": "Columbia University Archives catalog/search reference"
      },
      "created_at": "2026-07-05T12:00:00.000Z",
      "updated_at": "2026-07-05T12:00:00.000Z"
    },
    {
      "candidate_id": "lgfc-gehrig-2026-005",
      "input_stream": "public_research",
      "title": "Gehrig biography note lead 5 — Yankees",
      "source_url": "https://www.mlb.com/yankees/history",
      "source_name": "Yankees Official History",
      "source_owner": "Yankees Official History",
      "source_domain": "mlb.com",
      "source_type": "institution",
      "content_type": "biography_note",
      "summary": "Manual research candidate 5 from Yankees Official History; conservative rights and review defaults.",
      "date_or_period": "1927",
      "people_tags": [
        "Lou Gehrig"
      ],
      "topic_tags": [
        "Iron Horse"
      ],
      "location_tags": [
        "Cooperstown"
      ],
      "provenance_notes": "Manual URL intake only; no crawler.",
      "rights_status": "unknown",
      "source_trust_status": "trusted",
      "relevance_status": "relevant",
      "review_status": "approved_public_candidate",
      "publication_status": "draft_candidate",
      "privacy_flag": "none",
      "privacy_review_status": "not_applicable",
      "review_priority": "normal",
      "admin_notes": "Seed pilot record; not published.",
      "source_metadata": {
        "date_accessed": "2026-07-05",
        "source_citation": "Yankees Official History catalog/search reference"
      },
      "created_at": "2026-07-05T12:00:00.000Z",
      "updated_at": "2026-07-05T12:00:00.000Z"
    },
    {
      "candidate_id": "lgfc-gehrig-2026-006",
      "input_stream": "public_research",
      "title": "Gehrig record lead 6 — National",
      "source_url": "https://baseballhall.org/discover-more/stories/lou-gehrig",
      "source_name": "National Baseball Hall of Fame",
      "source_owner": "National Baseball Hall of Fame",
      "source_domain": "baseballhall.org",
      "source_type": "museum",
      "content_type": "record",
      "summary": "Manual research candidate 6 from National Baseball Hall of Fame; conservative rights and review defaults.",
      "date_or_period": "1928",
      "people_tags": [
        "Lou Gehrig"
      ],
      "topic_tags": [
        "Eleanor Gehrig"
      ],
      "location_tags": [
        "New York"
      ],
      "provenance_notes": "Manual URL intake only; no crawler.",
      "rights_status": "public_domain_candidate",
      "source_trust_status": "questionable",
      "relevance_status": "relevant",
      "review_status": "pending_review",
      "publication_status": "approved_for_publish",
      "privacy_flag": "none",
      "privacy_review_status": "not_applicable",
      "credit_line": "National Baseball Hall of Fame — research citation pending final review.",
      "review_priority": "normal",
      "admin_notes": "Seed pilot record; not published.",
      "source_metadata": {
        "date_accessed": "2026-07-05",
        "source_citation": "National Baseball Hall of Fame catalog/search reference"
      },
      "created_at": "2026-07-05T12:00:00.000Z",
      "updated_at": "2026-07-05T12:00:00.000Z"
    },
    {
      "candidate_id": "lgfc-gehrig-2026-007",
      "input_stream": "public_research",
      "title": "Gehrig artifact lead 7 — Library",
      "source_url": "https://www.loc.gov/search/?q=lou+gehrig",
      "source_name": "Library of Congress",
      "source_owner": "Library of Congress",
      "source_domain": "loc.gov",
      "source_type": "library",
      "content_type": "artifact",
      "summary": "Manual research candidate 7 from Library of Congress; conservative rights and review defaults.",
      "date_or_period": "1929",
      "people_tags": [
        "Lou Gehrig"
      ],
      "topic_tags": [
        "Lou Gehrig"
      ],
      "location_tags": [